{
 "contract": "btt_crossing_fixture_v1",
 "fixture_id": "upper_moving_platform_8b9ecf2b967f",
 "crossing": "upper_moving_platform",
 "source": {
  "kind": "user_recorded",
  "tool": "rl/m7g_capture.py",
  "input": "keyboard",
  "resumed_from": null,
  "keymap": {
   "stick": {
    "left": "LEFT",
    "right": "RIGHT",
    "up": "UP",
    "down": "DOWN"
   },
   "buttons": {
    "A": "X",
    "B": "C",
    "C-up": "SPACE",
    "C-left": "V",
    "L": "A",
    "R": "S",
    "Z": "Z"
   },
   "controls": {
    "pause": "P",
    "advance": "PERIOD",
    "slower": "LBRACKET",
    "faster": "RBRACKET",
    "quit": "CTRL+Q"
   }
  },
  "draft": "runs/m7g/capture/20260923T201858Z_upper/draft.json",
  "note": ""
 },
 "task": {
  "character": "mario",
  "stage": "break_the_targets_mario",
  "game_version": "us"
 },
 "action_contract": "btt_s9_b8_v1",
 "start": {
  "tick": 0,
  "reset": "fresh_process",
  "hidden_prefix": false
 },
 "sequence": {
  "length": 681,
  "track1": [
   [
    0,
    0
   ],
   [
    0,
    0
   ],
   [
    0,
    0
   ],
   [
    0,
    0
   ],
   [
    0,
    0
   ],
   [
    0,
    0
   ],
   [
    0,
    0
   ],
   [
    0,
    0
   ],
   [
    3,
    0
   ],
   [
    3,
    0
   ],
   [
    3,
    0
   ],
   [
    3,
    0
   ],
   [
    3,
    0
   ],
   [
    3,
    0
   ],
   [
    3,
    0
   ],
   [
    3,
    0
   ],
   [
    3,
    0
   ],
   [
    3,
    0
   ],
   [
    3,
    0
   ],
   [
    0,
    0
   ],
   [
    1,
    0
   ],
   [
    1,
    0
   ],
   [
    1,
    0
   ],
   [
    1,
    0
   ],
   [
    1,
    0
   ],
   [
    1,
    0
   ],
   [
    1,
    0
   ],
   [
    1,
    0
   ],
   [
    1,
    0
   ],
   [
    1,
    0
   ],
   [
    1,
    0
   ],
   [
    1,
    0
   ],
   [
    1,
    0
   ],
   [
    1,
    0
   ],
   [
    1,
    0
   ],
   [
    1,
    0
   ],
   [
    1,
    0
   ],
   [
    1,
    0
   ],
   [
    1,
    0
   ],
   [
    1,
    0
   ],
   [
    1,
    0
   ],
   [
    1,
    0
   ],
   [
    1,
    0
   ],
   [
    1,
    0
   ],
   [
    1,
    0
   ],
   [
    1,
    0
   ],
   [
    1,
    0
   ],
   [
    1,
    0
   ],
   [
    1,
    0
   ],
   [
    1,
    0
   ],
   [
    1,
    0
   ],
   [
    1,
    0
   ],
   [
    2,
    0
   ],
   [
    2,
    0
   ],
   [
    2,
    0
   ],
   [
    2,
    0
   ],
   [
    2,
    0
   ],
   [
    2,
    0
   ],
   [
    2,
    0
   ],
   [
    2,
    0
   ],
   [
    2,
    0
   ],
   [
    2,
    0
   ],
   [
    2,
    0
   ],
   [
    2,
    0
   ],
   [
    2,
    0
   ],
   [
    2,
    0
   ],
   [
    2,
    0
   ],
   [
    2,
    0
   ],
   [
    2,
    0
   ],
   [
    2,
    0
   ],
   [
    2,
    0
   ],
   [
    2,
    0
   ],
   [
    2,
    0
   ],
   [
    2,
    0
   ],
   [
    2,
    0
   ],
   [
    2,
    0
   ],
   [
    2,
    0
   ],
   [
    2,
    0
   ],
   [
    2,
    0
   ],
   [
    1,
    0
   ],
   [
    1,
    0
   ],
   [
    1,
    0
   ],
   [
    1,
    0
   ],
   [
    1,
    0
   ],
   [
    1,
    0
   ],
   [
    1,
    0
   ],
   [
    1,
    0
   ],
   [
    1,
    0
   ],
   [
    1,
    0
   ],
   [
    1,
    0
   ],
   [
    1,
    0
   ],
   [
    1,
    0
   ],
   [
    1,
    0
   ],
   [
    1,
    0
   ],
   [
    1,
    0
   ],
   [
    1,
    0
   ],
   [
    1,
    0
   ],
   [
    1,
    0
   ],
   [
    1,
    0
   ],
   [
    1,
    0
   ],
   [
    1,
    0
   ],
   [
    1,
    0
   ],
   [
    1,
    0
   ],
   [
    0,
    0
   ],
   [
    0,
    0
   ],
   [
    0,
    0
   ],
   [
    0,
    0
   ],
   [
    0,
    0
   ],
   [
    0,
    0
   ],
   [
    0,
    0
   ],
   [
    0,
    0
   ],
   [
    0,
    0
   ],
   [
    0,
    0
   ],
   [
    0,
    0
   ],
   [
    0,
    0
   ],
   [
    0,
    0
   ],
   [
    0,
    0
   ],
   [
    0,
    0
   ],
   [
    0,
    0
   ],
   [
    0,
    0
   ],
   [
    0,
    0
   ],
   [
    0,
    0
   ],
   [
    0,
    0
   ],
   [
    0,
    0
   ],
   [
    0,
    0
   ],
   [
    0,
    0
   ],
   [
    0,
    0
   ],
   [
    3,
    0
   ],
   [
    3,
    0
   ],
   [
    3,
    0
   ],
   [
    3,
    0
   ],
   [
    3,
    0
   ],
   [
    3,
    0
   ],
   [
    1,
    0
   ],
   [
    1,
    0
   ],
   [
    1,
    0
   ],
   [
    1,
    0
   ],
   [
    1,
    0
   ],
   [
    1,
    0
   ],
   [
    1,
    0
   ],
   [
    1,
    0
   ],
   [
    1,
    0
   ],
   [
    1,
    0
   ],
   [
    1,
    0
   ],
   [
    1,
    0
   ],
   [
    1,
    0
   ],
   [
    1,
    0
   ],
   [
    0,
    0
   ],
   [
    0,
    0
   ],
   [
    0,
    0
   ],
   [
    0,
    0
   ],
   [
    0,
    0
   ],
   [
    0,
    0
   ],
   [
    0,
    0
   ],
   [
    0,
    0
   ],
   [
    0,
    0
   ],
   [
    0,
    0
   ],
   [
    0,
    0
   ],
   [
    0,
    0
   ],
   [
    0,
    0
   ],
   [
    7,
    0
   ],
   [
    7,
    0
   ],
   [
    7,
    0
   ],
   [
    7,
    0
   ],
   [
    7,
    0
   ],
   [
    0,
    0
   ],
   [
    0,
    0
   ],
   [
    0,
    0
   ],
   [
    7,
    0
   ],
   [
    7,
    0
   ],
   [
    7,
    0
   ],
   [
    0,
    0
   ],
   [
    0,
    0
   ],
   [
    7,
    0
   ],
   [
    7,
    0
   ],
   [
    0,
    0
   ],
   [
    0,
    0
   ],
   [
    0,
    0
   ],
   [
    0,
    0
   ],
   [
    0,
    0
   ],
   [
    3,
    0
   ],
   [
    3,
    0
   ],
   [
    3,
    0
   ],
   [
    3,
    0
   ],
   [
    3,
    0
   ],
   [
    3,
    0
   ],
   [
    3,
    0
   ],
   [
    3,
    0
   ],
   [
    3,
    0
   ],
   [
    3,
    0
   ],
   [
    3,
    0
   ],
   [
    0,
    0
   ],
   [
    0,
    0
   ],
   [
    0,
    0
   ],
   [
    0,
    0
   ],
   [
    0,
    0
   ],
   [
    0,
    0
   ],
   [
    0,
    0
   ],
   [
    0,
    0
   ],
   [
    0,
    0
   ],
   [
    0,
    0
   ],
   [
    0,
    0
   ],
   [
    0,
    0
   ],
   [
    0,
    0
   ],
   [
    0,
    0
   ],
   [
    0,
    0
   ],
   [
    0,
    0
   ],
   [
    0,
    0
   ],
   [
    3,
    0
   ],
   [
    3,
    0
   ],
   [
    3,
    0
   ],
   [
    3,
    0
   ],
   [
    3,
    0
   ],
   [
    3,
    0
   ],
   [
    3,
    0
   ],
   [
    3,
    0
   ],
   [
    3,
    0
   ],
   [
    3,
    0
   ],
   [
    3,
    0
   ],
   [
    0,
    0
   ],
   [
    0,
    0
   ],
   [
    0,
    0
   ],
   [
    0,
    0
   ],
   [
    5,
    0
   ],
   [
    5,
    0
   ],
   [
    5,
    0
   ],
   [
    5,
    0
   ],
   [
    5,
    0
   ],
   [
    5,
    0
   ],
   [
    5,
    0
   ],
   [
    5,
    0
   ],
   [
    5,
    0
   ],
   [
    5,
    0
   ],
   [
    0,
    0
   ],
   [
    0,
    0
   ],
   [
    0,
    0
   ],
   [
    0,
    0
   ],
   [
    0,
    0
   ],
   [
    0,
    0
   ],
   [
    0,
    0
   ],
   [
    0,
    0
   ],
   [
    0,
    0
   ],
   [
    0,
    0
   ],
   [
    5,
    0
   ],
   [
    5,
    0
   ],
   [
    5,
    0
   ],
   [
    5,
    0
   ],
   [
    0,
    0
   ],
   [
    0,
    0
   ],
   [
    0,
    0
   ],
   [
    0,
    0
   ],
   [
    0,
    0
   ],
   [
    0,
    0
   ],
   [
    0,
    0
   ],
   [
    0,
    0
   ],
   [
    0,
    0
   ],
   [
    0,
    0
   ],
   [
    0,
    0
   ],
   [
    0,
    0
   ],
   [
    0,
    0
   ],
   [
    0,
    0
   ],
   [
    0,
    0
   ],
   [
    0,
    0
   ],
   [
    0,
    0
   ],
   [
    3,
    0
   ],
   [
    3,
    0
   ],
   [
    3,
    0
   ],
   [
    3,
    0
   ],
   [
    3,
    0
   ],
   [
    3,
    0
   ],
   [
    3,
    0
   ],
   [
    3,
    0
   ],
   [
    4,
    0
   ],
   [
    4,
    0
   ],
   [
    4,
    0
   ],
   [
    4,
    0
   ],
   [
    4,
    0
   ],
   [
    4,
    0
   ],
   [
    4,
    0
   ],
   [
    4,
    0
   ],
   [
    4,
    0
   ],
   [
    4,
    0
   ],
   [
    4,
    0
   ],
   [
    5,
    0
   ],
   [
    5,
    0
   ],
   [
    5,
    0
   ],
   [
    5,
    0
   ],
   [
    5,
    0
   ],
   [
    5,
    0
   ],
   [
    5,
    0
   ],
   [
    5,
    0
   ],
   [
    5,
    0
   ],
   [
    5,
    0
   ],
   [
    5,
    0
   ],
   [
    5,
    0
   ],
   [
    5,
    0
   ],
   [
    5,
    0
   ],
   [
    5,
    0
   ],
   [
    5,
    0
   ],
   [
    5,
    0
   ],
   [
    5,
    0
   ],
   [
    5,
    0
   ],
   [
    5,
    0
   ],
   [
    5,
    0
   ],
   [
    5,
    0
   ],
   [
    5,
    0
   ],
   [
    5,
    0
   ],
   [
    5,
    0
   ],
   [
    5,
    0
   ],
   [
    5,
    0
   ],
   [
    5,
    0
   ],
   [
    5,
    0
   ],
   [
    5,
    0
   ],
   [
    5,
    0
   ],
   [
    5,
    0
   ],
   [
    5,
    0
   ],
   [
    5,
    0
   ],
   [
    5,
    0
   ],
   [
    5,
    0
   ],
   [
    5,
    0
   ],
   [
    5,
    0
   ],
   [
    5,
    0
   ],
   [
    5,
    0
   ],
   [
    5,
    0
   ],
   [
    5,
    0
   ],
   [
    5,
    0
   ],
   [
    5,
    0
   ],
   [
    5,
    0
   ],
   [
    5,
    0
   ],
   [
    5,
    0
   ],
   [
    5,
    0
   ],
   [
    5,
    0
   ],
   [
    5,
    0
   ],
   [
    5,
    0
   ],
   [
    5,
    0
   ],
   [
    4,
    0
   ],
   [
    4,
    0
   ],
   [
    4,
    0
   ],
   [
    4,
    0
   ],
   [
    4,
    0
   ],
   [
    5,
    0
   ],
   [
    5,
    0
   ],
   [
    5,
    0
   ],
   [
    5,
    0
   ],
   [
    5,
    0
   ],
   [
    5,
    0
   ],
   [
    5,
    0
   ],
   [
    5,
    0
   ],
   [
    5,
    0
   ],
   [
    5,
    0
   ],
   [
    5,
    0
   ],
   [
    5,
    0
   ],
   [
    5,
    0
   ],
   [
    5,
    0
   ],
   [
    5,
    0
   ],
   [
    5,
    0
   ],
   [
    5,
    0
   ],
   [
    5,
    0
   ],
   [
    5,
    0
   ],
   [
    5,
    0
   ],
   [
    5,
    0
   ],
   [
    5,
    0
   ],
   [
    5,
    0
   ],
   [
    5,
    0
   ],
   [
    5,
    0
   ],
   [
    5,
    0
   ],
   [
    5,
    0
   ],
   [
    5,
    0
   ],
   [
    5,
    0
   ],
   [
    5,
    0
   ],
   [
    5,
    0
   ],
   [
    5,
    0
   ],
   [
    5,
    0
   ],
   [
    4,
    0
   ],
   [
    4,
    0
   ],
   [
    4,
    0